<!ELEMENT employees (employee+)>
<!ELEMENT employee (employeeID, name, department, position, salary)>
<!ELEMENT employeeID (#PCDATA)>
<!ELEMENT name (#PCDATA)>
<!ELEMENT department (#PCDATA)>
<!ELEMENT position (#PCDATA)>
<!ELEMENT salary (#PCDATA)>
