<?xml version="1.0" encoding="UTF-8"?>
<!DOCTYPE employees SYSTEM "employees.dtd">
<employees>
    <employee>
        <employeeID>1001</employeeID>
        <name>John Doe</name>
        <department>IT</department>
        <position>Software Engineer</position>
        <salary>60000</salary>
    </employee>
    <employee>
        <employeeID>1002</employeeID>
        <name>Jane Smith</name>
        <department>HR</department>
        <position>HR Manager</position>
        <salary>75000</salary>
    </employee>
    <!-- Add more employees as needed -->
</employees>
